{
  "$schema": "https://json-schema.org/draft/2020-12/schema",
  "$id": "https://quantum-vault.local/schema/qv-transition-record-v1.schema.json",
  "title": "Quantum Vault transition record v1",
  "type": "object",
  "additionalProperties": false,
  "required": [
    "schema",
    "version",
    "canonicalization",
    "transitionType",
    "archiveId",
    "fromStateId",
    "toStateId",
    "fromCohortId",
    "toCohortId",
    "fromCohortBindingDigest",
    "toCohortBindingDigest",
    "reasonCode",
    "performedAt",
    "operatorRole",
    "actorHints",
    "notes"
  ],
  "properties": {
    "schema": {
      "$ref": "qv-common-types.schema.json#/$defs/transitionRecordSchemaId"
    },
    "version": {
      "const": 1
    },
    "canonicalization": {
      "$ref": "qv-common-types.schema.json#/$defs/manifestCanonicalizationLabel"
    },
    "transitionType": {
      "$ref": "qv-common-types.schema.json#/$defs/nonEmptyString"
    },
    "archiveId": {
      "$ref": "qv-common-types.schema.json#/$defs/archiveIdHex"
    },
    "fromStateId": {
      "$ref": "qv-common-types.schema.json#/$defs/stateIdHex"
    },
    "toStateId": {
      "$ref": "qv-common-types.schema.json#/$defs/stateIdHex"
    },
    "fromCohortId": {
      "$ref": "qv-common-types.schema.json#/$defs/cohortIdHex"
    },
    "toCohortId": {
      "$ref": "qv-common-types.schema.json#/$defs/cohortIdHex"
    },
    "fromCohortBindingDigest": {
      "$ref": "#/$defs/sha3_512Digest"
    },
    "toCohortBindingDigest": {
      "$ref": "#/$defs/sha3_512Digest"
    },
    "reasonCode": {
      "$ref": "qv-common-types.schema.json#/$defs/nonEmptyString"
    },
    "performedAt": {
      "type": "string",
      "pattern": "^\\d{4}-\\d{2}-\\d{2}T\\d{2}:\\d{2}:\\d{2}(?:\\.\\d{3})?Z$"
    },
    "operatorRole": {
      "$ref": "qv-common-types.schema.json#/$defs/nonEmptyString"
    },
    "actorHints": {
      "type": "object"
    },
    "notes": {
      "$ref": "qv-common-types.schema.json#/$defs/nullableString"
    }
  },
  "$defs": {
    "sha3_512Digest": {
      "type": "object",
      "additionalProperties": false,
      "required": [
        "alg",
        "value"
      ],
      "properties": {
        "alg": {
          "$ref": "qv-common-types.schema.json#/$defs/sha3_512Alg"
        },
        "value": {
          "$ref": "qv-common-types.schema.json#/$defs/sha3_512Hex"
        }
      }
    }
  }
}
